{
  "name": "Chronicle",
  "script": "Chronicle",
  "version": "1.0.0",
  "description": "Chronicle is a comprehensive calendar and timeline management system for Roll20 campaigns.\n\nKEY FEATURES:\n• Create custom calendars or load presets (Gregorian, Forgotten Realms, Golarion, Greyhawk, Eberron)\n• Track events and notes with a powerful tagging system for organizing and filtering\n• Calendar view with interactive grid navigation and date-by-date exploration\n• Timeline mode for chronological story review with tag and date-range filtering\n• Automatic weather generation based on Köppen climate zones\n• Multiple moons with automatic phase calculation for any date\n• Send to Chat feature to announce dates and events to players\n• GM-only content filtering (tag items 'gm' to hide from chat output)\n• Special days, holidays, leap days, and intercalary days support\n\nGETTING STARTED:\n1. Install the script in your campaign\n2. Run !chr to initialize (creates your main interface handout)\n3. Choose: Load a preset calendar (30 seconds) or create a custom one (30 minutes)\n4. Start adding events, notes, and tracking campaign time\nRun !chr --help anytime for detailed documentation.\n\nDESIGN MODE:\nConfigure your calendar with custom months, weeks, climate zones, holidays, and moons. The interface handles all calculations automatically—no spreadsheets or complex setup required.\n\nPERFECT FOR:\nLong-term campaigns where tracking in-game time enhances storytelling. Works with any system—D&D, Pathfinder, Vampire, etc. No coding knowledge required.",
  "authors": "Keith Curtis",
  "roll20userid": "162065",
  "modifies": {
    "handout": "read,write"
  },
  "patreon": "https://www.patreon.com/c/KeithCurtis",
  "dependencies": [],
  "conflicts": [],
  "previousversions": ["1.0.0"]
}