{
  "name": "TokenMod",
  "script": "TokenMod.js",
  "version": "0.8.91",
  "description": "TokenMod provides an interface to setting almost all settable properties of a token.\r\rFor instructions see the *Help: TokenMod* Handout in game, or run `!token-mod --help` in game, or visit [TokenMod Forum Thread](https://app.roll20.net/forum/post/4225825/script-update-tokenmod-an-interface-to-adjusting-properties-of-a-token-from-a-macro-or-the-chat-area).",
  "authors": "The Aaron",
  "roll20userid": "104025",
  "patreon": "https://www.patreon.com/shdwjk",
  "useroptions": [
    {
      "name": "Players can use --ids",
      "type": "checkbox",
      "description": "Select this option to allow players to use the `--ids` parameter to specify tokens they don't control to be modified.",
      "value": "playersCanIDs"
    }
  ],
  "dependencies": [],
  "modifies": {},
  "conflicts": [],
  "previousversions": [
    "0.8.19",
    "0.8.20",
    "0.8.21",
    "0.8.22",
    "0.8.23",
    "0.8.24",
    "0.8.25",
    "0.8.26",
    "0.8.27",
    "0.8.29",
    "0.8.30",
    "0.8.31",
    "0.8.34",
    "0.8.35",
    "0.8.36",
    "0.8.37",
    "0.8.38",
    "0.8.39",
    "0.8.40",
    "0.8.41",
    "0.8.42",
    "0.8.43",
    "0.8.44",
    "0.8.45",
    "0.8.46",
    "0.8.47",
    "0.8.48",
    "0.8.50",
    "0.8.51",
    "0.8.52",
    "0.8.54",
    "0.8.55",
    "0.8.56",
    "0.8.57",
    "0.8.58",
    "0.8.59",
    "0.8.60",
    "0.8.61",
    "0.8.62",
    "0.8.63",
    "0.8.64",
    "0.8.65",
    "0.8.66",
    "0.8.67",
    "0.8.68",
    "0.8.69",
    "0.8.70",
    "0.8.71",
    "0.8.72",
    "0.8.73",
    "0.8.74",
    "0.8.75",
    "0.8.76",
    "0.8.77",
    "0.8.78",
    "0.8.79",
    "0.8.80",
    "0.8.81",
    "0.8.82",
    "0.8.84",
    "0.8.85",
    "0.8.86",
    "0.8.87",
    "0.8.88"
  ]
}