{
  "name": "InitiativeAssistant",
  "version": "0.1.6",
  "description": "Provides an easy interface to adding players to the inititaive order.\r\rFor instructions, run `!init-assist --help`, or visit [InitiativeAssistant Forum Thread](https://app.roll20.net/forum/permalink/1854729/).",
  "authors": "The Aaron",
  "roll20userid": "104025",
  "patreon": "https://www.patreon.com/shdwjk",
  "dependencies": {},
  "modifies": {
    "state.InitiativeAssistant": "read,write",
    "campaign.turnorder": "read,write",
    "character.name": "read",
    "token.represents": "read"
  },
  "conflicts": [],
  "script": "InitiativeAssistant.js",
  "useroptions": [],
  "previousversions": [
    "0.1.3",
    "0.1.4",
    "0.1.5"
  ]
}