{
  "name": "Bet",
  "version": "0.1.4",
  "description": "",
  "authors": "The Aaron",
  "roll20userid": "104025",
  "patreon": "https://www.patreon.com/shdwjk",
  "dependencies": {},
  "modifies": {
    "state.Bet": "read,write"
  },
  "conflicts": [],
  "script": "Bet.js",
  "useroptions": [],
  "previousversions": [
    "0.1.3"
  ]
}