{
    "name": "Sequence",
    "script": "Sequence.js",
    "version": "1.1.0",
    "previousversions": [
        "0.2.0",
        "1.0.0",
        "1.0.1"
    ],
    "description": "# Sequence\n\n[Wiki Page](https://wiki.roll20.net/Script:Sequence)\n\nA general-purpose keyframe animation engine for Roll20 tokens. Record token movements and attribute changes in real time, then play them back on any token with smooth interpolation, easing, looping, speed control, and expression-driven values.\n\n## Features\n\n- **Record** -- Move a token and change its attributes while Sequence captures each change as a timestamped keyframe.\n- **Playback** -- Replay recordings on any token with smooth lerp interpolation between keyframes.\n- **Easing** -- Per-attribute easing curves: `linear`, `sine`, `quad`, `cubic`, `expo`, `circle`, `power(n)`, `bezier(x1,y1,x2,y2)` (CSS cubic-bezier). Ease-in, ease-out, and ease-in-out all supported.\n- **Expressions** -- Keyframe values can be expressions: `+rand(-140,140)`, `=clamp(prev+50,orig-200,orig+200)`, `=color.hsl(rand(0,360),100,50)`.\n- **String Animation** -- Animate text attributes (name, tooltip) with Levenshtein-based interpolation. Type-out effects with easing.\n- **Unit Functions** -- `cell(n)` for grid cells, `unit(n)` for map-scale distance, `get(\"attr\")` to reference other attributes.\n- **Looping** -- Loop indefinitely or N times, with `reset` (snap back) or `accumulate` (each cycle builds on the last) modes.\n- **Built-in Examples** -- 8 ready-to-use animations: spin, hover, pulse, orbit, shake, torch-flicker, rgb-cycle, boss-phase-2. Generate via `!sequence example`.\n- **UDL Lighting** -- Animate both legacy and Updated Dynamic Lighting properties.\n- **Portable** -- Recordings stored in `[Sequence] name` handouts. Copy a handout to another campaign to transfer an animation.\n- **Extensible** -- External scripts can register custom attributes, expression functions, constants, and easing curves.\n\n## Quick Start\n\n1. Type `!sequence example` to see built-in animations, then click Generate and Play\n2. Or: select a token and type `!sequence record my-animation`\n3. Move the token and change its attributes\n4. Type `!sequence stop` -- the recording saves automatically\n5. Select any token and type `!sequence play my-animation`\n\n## Commands\n\n`!sequence record [name] [--attrs a,b,...]` -- Start recording selected token(s)\n\n`!sequence stop` -- Stop and save recording\n\n`!sequence pause` / `!sequence resume` -- Pause/resume recording\n\n`!sequence play <name> [--loop] [--loops n] [--speed x] [--reverse] [--offset ms] [--only a,b] [--exclude a,b]` -- Play a recording\n\n`!sequence preview <name>` -- Play and auto-revert when finished\n\n`!sequence stop-play` / `!sequence pause-play` / `!sequence resume-play` -- Control playback\n\n`!sequence example [search]` -- List built-in examples with Play/Loop buttons\n\n`!sequence example! <name>` -- Generate an example recording handout\n\n`!sequence list` -- List all recordings\n\n`!sequence edit <name>` -- Open the recording handout\n\n`!sequence delete <name>` -- Delete a recording\n\n`!sequence add-attribute <name> <attr>` -- Add an attribute column\n\n`!sequence remove-attribute <name> <attr>` -- Remove an attribute column\n\n`!sequence add-row <name> <time>` -- Add a blank keyframe row\n\n`!sequence sort <name>` -- Sort keyframes by time\n\n`!sequence refresh <name>` -- Regenerate handout from cache\n\n`!sequence man [topic]` -- In-game help. Topics: `attr`, `func`, `vars`, `easing`, or any name\n\n`!sequence debug` -- Show active sessions\n\n`!sequence dump-html <name>` -- Print raw handout HTML to the API console\n\n`!sequence gen-dev-docs` -- Generate the extension developer guide in your journal\n\n## Attributes\n\nAll standard graphic token properties are supported: `left`, `top`, `rotation`, `width`, `height`, `bar1_value`-`bar3_value`, auras, lighting (legacy + UDL), colors, strings (`name`, `tooltip`), booleans, and more. Run `!sequence man attr` in chat for the full list.\n\n## Extension API\n\nOther scripts can extend Sequence by listening for the `!sequence-ready` chat signal and calling:\n\n`Sequence.registerAttribute` / `Sequence.registerAttributeGroup` / `Sequence.registerValueFunction` / `Sequence.registerTimingFunction` / `Sequence.registerPlaybackConstant` / `Sequence.registerEasing` / `Sequence.registerExample` / `Sequence.generateExtensionHandout`\n\nRun `!sequence gen-dev-docs` to generate the full extension developer guide.\n\n**v1.1.0 - New features:**\n- ScriptKit integration: help, whatsnew, gen-help handout generation\n\nCommands:\n- `!sequence record [name] [--attrs a,b,...] [obj_id...]` -- Start recording on selected/listed tokens\n- `!sequence stop [obj_id...]` -- Stop recording (auto-saves if name was given)\n- `!sequence pause [obj_id...]` -- Pause recording without discarding keyframes\n- `!sequence resume [obj_id...]` -- Resume a paused recording\n- `!sequence save <name> [--force] [obj_id...]` -- Save unnamed recording under <name>\n- `!sequence play <name> [flags] [obj_id...]` -- Play a recording on selected/listed tokens\n- `!sequence preview <name> [flags] [obj_id...]` -- Play and auto-revert when finished\n- `!sequence stop-play [obj_id...]` -- Stop playback on selected/listed tokens\n- `!sequence pause-play [obj_id...]` -- Pause active playback\n- `!sequence resume-play [obj_id...]` -- Resume paused playback\n- `!sequence playback-menu [obj_id...]` -- Show playback controls for active playback\n- `!sequence list` -- List all saved recordings\n- `!sequence edit <name>` -- Open the recording handout editor\n- `!sequence delete <name> [--force]` -- Delete a recording\n- `!sequence add-attribute <name> <attr>` -- Add an attribute column to a recording\n- `!sequence remove-attribute <name> <attr>` -- Remove an attribute column from a recording\n- `!sequence add-row <name> <time_ms>` -- Add blank keyframe row at given time\n- `!sequence add-command <name> <time_ms> <chat-command>` -- Add command keyframe to saved recording\n- `!sequence command <chat-command> [obj_id...]` -- Insert command keyframe during active recording\n- `!sequence sort <name>` -- Re-parse and sort keyframes by time\n- `!sequence set-easing <name> <time_ms> <attr> <easing>` -- Set easing for a keyframe\n- `!sequence set-type <name> <time_ms> <type>` -- Set keyframe type\n- `!sequence refresh <name>` -- Regenerate handout from parsed cache\n- `!sequence example [search]` -- List built-in examples with Play/Loop buttons\n- `!sequence example! <name>` -- Generate an example recording handout\n- `!sequence debug` -- Show active recording/playback sessions\n- `!sequence dump-html <name>` -- Print raw handout HTML to API console",
    "authors": "Kenan Millet",
    "roll20userid": "2614613",
    "dependencies": [
        "ScriptKit"
    ],
    "modifies": {
        "graphic.left": "read, write",
        "graphic.top": "read, write",
        "graphic.rotation": "read, write",
        "graphic.width": "read, write",
        "graphic.height": "read, write",
        "graphic.bar1_value": "read, write",
        "graphic.bar2_value": "read, write",
        "graphic.bar3_value": "read, write",
        "graphic.tint_color": "read, write",
        "graphic.aura1_color": "read, write",
        "graphic.aura2_color": "read, write",
        "graphic.bright_light_distance": "read, write",
        "graphic.low_light_distance": "read, write",
        "graphic.name": "read, write",
        "graphic.layer": "read, write",
        "handout.notes": "read, write"
    },
    "conflicts": [],
    "useroptions": [
        {
            "name": "Playback FPS",
            "type": "select",
            "options": [
                "5",
                "10",
                "15",
                "20",
                "30"
            ],
            "default": "30",
            "description": "Frames per second for animation playback. Higher values are smoother but increase API load. 30 is recommended for most games; try 10-15 if you experience performance issues."
        }
    ]
}
