{
    "name": "Earthdawn by FASA character sheet companion",
    "script": "Earthdawn.js",
    "version": "03.301",
    "previousversions": ["03.30","03.19","03.15","03.023","03.022","03.021","03.020","03.001","03.000","02.042","02.041","02.040","02.000","01.002","01.001","01.000"],
    "description": "The Roll20 \"Earthdawn by FASA character sheet companion\" API script is made to work with the \"Earthdawn by FASA\" character sheet and \"Earthdawn 4th Edition\" Compendium. It provides many features that automate and assist in many tasks. It is optimized for Earthdawn 4th edition and 1879 1st Edition, but currently has limited support for other editions.\r\r For more information please see [Earthdawn Sheet wiki page](https://wiki.roll20.net/Earthdawn_-_FASA_Official_V2).",
    "authors": "Chris Dickey",
    "roll20userid": "633707",
    "useroptions": [],
    "dependencies": ["HTML Builder"],
    "conflicts": []
}
